{
  "manifestVersion": "1",
  "artifactDigest": "sha256:aaaaaaaaaaaaaaaaaaaaaaaaaaaaaaaaaaaaaaaaaaaaaaaaaaaaaaaaaaaaaaaa",
  "languageProfile": {"name": "fixture-profile", "version": "1"},
  "engineVersion": "fixture-engine-1",
  "wasiVersion": "0.2.0",
  "interfaceVersion": "0.1.0",
  "imports": [],
  "budgets": {"fuel": 1000, "memoryBytes": 65536, "timeoutMs": 100, "maxHostCalls": 10},
  "grants": [],
  "effectiveConfiguration": {},
  "provenance": {"ref": "urn:fixture:provenance", "digest": "sha256:bbbbbbbbbbbbbbbbbbbbbbbbbbbbbbbbbbbbbbbbbbbbbbbbbbbbbbbbbbbbbbbb"},
  "sbom": {"ref": "urn:fixture:sbom", "digest": "sha256:cccccccccccccccccccccccccccccccccccccccccccccccccccccccccccccccc"}
}
