{
  "manifestVersion": "1",
  "artifactDigest": "sha256:aaaaaaaaaaaaaaaaaaaaaaaaaaaaaaaaaaaaaaaaaaaaaaaaaaaaaaaaaaaaaaaa",
  "languageProfile": {"name": "fixture-profile", "version": "1"},
  "engineVersion": "fixture-engine-1",
  "wasiVersion": "0.2.0",
  "interfaceVersion": "0.1.0",
  "imports": ["falcone:host/storage@0.1.0"],
  "budgets": {"fuel": 1000, "memoryBytes": 65536, "timeoutMs": 100, "maxHostCalls": 10},
  "grants": [{"family": "storage", "interface": "falcone:host/storage@0.1.0", "scope": {"prefixes": ["fixtures/"]}, "secretRef": {"name": "fixture-binding", "version": "1"}}],
  "effectiveConfiguration": {"timeoutMs": 100.0, "maxTokens": 2, "logLevel": "info", "enabled": false},
  "provenance": {"ref": "urn:fixture:provenance", "digest": "sha256:bbbbbbbbbbbbbbbbbbbbbbbbbbbbbbbbbbbbbbbbbbbbbbbbbbbbbbbbbbbbbbbb"},
  "sbom": {"ref": "urn:fixture:sbom", "digest": "sha256:cccccccccccccccccccccccccccccccccccccccccccccccccccccccccccccccc"}
}
